{
  "extraction": {
    "title": "Integration & Test Engineer",
    "level": null,
    "location": "Aurora, CO",
    "work_model": "On-Site/Office",
    "clearance": "Top Secret/SCI",
    "experience": "5 years",
    "education": "Bachelor's degree in Science, Technology, Engineering or Mathematics (STEM)",
    "company": "Smart Synergies"
  },
  "skills": {
    "technical": {
      "required": [
        "C++ software development",
        "Python software development",
        "Software integration and test automation"
      ],
      "preferred": [
        "Bash scripting",
        "GitLab pipelines",
        "Pytest",
        "Gotest",
        "Google Test",
        "Atlassian toolset",
        "Go software development",
        "Developing acceptance criteria"
      ],
      "certifications": []
    },
    "soft_skills": [
      "Collaboration",
      "Teamwork",
      "Agile methodology"
    ]
  },
  "tools": {
    "tools": [
      "Bash",
      "Python",
      "C++",
      "GitLab pipelines",
      "Pytest",
      "Gotest",
      "Google Test",
      "Atlassian toolset",
      "Go"
    ]
  },
  "summary": "**Integration & Test Engineer at Smart Synergies**\n\nSmart Synergies is seeking an Integration & Test Engineer in Aurora, CO. This is an on-site role within the IT - QA and Test industry. The position involves joining a small team focused on developing and maintaining signal processing applications for real-time operational environments. Key responsibilities include testing and deploying advanced software, and building test automation pipelines using Bash and Python.\n\nThe ideal candidate will have a Bachelor's degree in a STEM field with 5 years of relevant software engineering experience, including C++ and Python development and software integration and test automation experience. An active and transferable TS/SCI security clearance (or a Top Secret clearance that can be crossed over) is required. Preferred qualifications include experience with Bash scripting, GitLab pipelines, testing frameworks (Pytest, Gotest, Google Test), acceptance criteria development, Atlassian tools, and Go software development. The role offers the opportunity to learn modern DevSecOps and CI/CD techniques, as well as software lifecycle practices for defense projects [clearancejobs.com](https://www.clearancejobs.com/jobs/8126142/isse-systems-engineering-and-test-set-analyst). Other relevant roles in Colorado with security clearances include System Integration and Test Engineer and Senior Software Engineer - Site Reliability (CI/CD) [itjobpro.com](https://itjobpro.com/job/system-integration-and-test-engineer-3) [itjobpro.com](https://itjobpro.com/job/senior-software-engineer-site-reliability-ci-cd).",
  "url": "https://www.clearancejobs.com/jobs/8212863/integration-test-engineer-914713812",
  "comprehensive_report": "# \ud83d\udccb EXECUTIVE SUMMARY\n\nThis report provides a comprehensive analysis of the Integration & Test Engineer position at Smart Synergies in Aurora, CO. The role is an on-site position within the IT - QA and Test sector, focusing on developing and maintaining signal processing applications for real-time operational environments. Key responsibilities include advanced software testing and deployment, and building test automation pipelines using Bash and Python. A significant requirement is an active and transferable Top Secret/SCI security clearance. The position offers exposure to modern DevSecOps and CI/CD techniques within the defense sector.\n\n## \ud83c\udfe2 COMPANY PROFILE & ANALYSIS\n\n- **Company Overview & Market Position**: Smart Synergies is a company operating within the defense and IT sectors, specifically focusing on signal processing applications for real-time operational environments. While the specific size and detailed market position are not explicitly stated in the provided data, the nature of the work (defense projects requiring TS/SCI clearance) suggests they operate within a specialized and critical niche of the government contracting and technology landscape. Their focus on advanced software and test automation indicates a position within the modern IT infrastructure supporting defense capabilities.\n\n- **Industry Context & Competitive Landscape**: The position falls within the IT - QA and Test industry, specifically within the defense contracting sector. This industry is highly competitive, with numerous companies vying for government contracts. Key competitors would include other defense contractors and technology companies specializing in secure software development, testing, and deployment for government clients. The requirement for a TS/SCI clearance significantly narrows the pool of eligible candidates and companies, creating a specialized competitive landscape. Related roles in the Colorado area with similar clearance requirements further illustrate this competitive environment [itjobpro.com](https://itjobpro.com/job/system-integration-and-test-engineer-3) [itjobpro.com](https://itjobpro.com/job/senior-software-engineer-site-reliability-ci-cd).\n\n- **Company Culture & Work Environment**: The job description mentions joining a \"small team.\" This suggests a potentially close-knit and collaborative work environment. The emphasis on Agile methodology and teamwork as soft skills further supports this. The on-site nature of the role in Aurora, CO, indicates a traditional office environment. The focus on modern DevSecOps and CI/CD techniques implies a forward-thinking approach to software development practices.\n\n- **Growth Trajectory & Future Outlook**: The defense sector, particularly in areas involving advanced technology and secure systems, generally has a stable to growing outlook due to ongoing government investment. The opportunity to learn modern DevSecOps and CI/CD techniques suggests the company is investing in current industry best practices, which is a positive sign for future growth and relevance. The nature of defense projects often involves long-term contracts, potentially offering stability.\n\n## \ud83d\udcbc POSITION ANALYSIS\n\n- **Role Overview & Responsibilities**: The core function of the Integration & Test Engineer is to ensure the quality and functionality of signal processing applications in real-time operational environments. Key responsibilities include:\n    * Testing and deploying advanced software.\n    * Building and maintaining test automation pipelines using Bash and Python.\n    * Working within a small team environment.\n    * Contributing to the development and maintenance of signal processing applications.\n\n- **Required Technical Skills & Competencies**:\n    * **C++ software development**: Essential for working with potentially performance-critical signal processing applications.\n    * **Python software development**: Crucial for building and maintaining test automation pipelines.\n    * **Software integration and test automation**: Fundamental to the role, ensuring seamless integration of software components and automating testing processes for efficiency and reliability.\n    * **Critical Skills**: C++ development, Python development, and software integration/test automation are explicitly required and form the foundation of the role.\n    * **Nice-to-Have Skills**:\n        * Bash scripting: Useful for scripting and automation tasks, particularly in Linux environments common in defense systems.\n        * GitLab pipelines: Experience with CI/CD pipelines is valuable for modern software development workflows.\n        * Pytest, Gotest, Google Test: Familiarity with specific testing frameworks enhances testing capabilities.\n        * Atlassian toolset: Common project management and collaboration tools in software development.\n        * Go software development: Experience with another programming language can be beneficial.\n        * Developing acceptance criteria: Important for defining the requirements and success metrics for testing.\n\n- **Experience & Educational Requirements**:\n    * **Experience**: 5 years of relevant software engineering experience. This suggests a need for a solid foundation in software development principles and practices.\n    * **Education**: Bachelor's degree in Science, Technology, Engineering or Mathematics (STEM). This is a standard requirement for technical roles and indicates the need for a strong theoretical background.\n    * **Clearance**: Active and transferable TS/SCI security clearance (or a Top Secret clearance that can be crossed over). This is a critical and non-negotiable requirement for working on defense projects of this nature.\n\n- **Career Growth & Advancement Opportunities**: The role offers the opportunity to gain experience in modern DevSecOps and CI/CD techniques, which are highly sought-after skills in the tech industry. Working on defense projects provides exposure to complex systems and rigorous development processes. Potential career paths could involve specializing further in test automation, moving into a lead or senior engineering role, or transitioning into related areas like systems engineering or DevSecOps engineering within the defense or government contracting sectors. The small team environment could also offer opportunities for broader involvement and skill development.\n\n## \ud83d\udcb0 COMPENSATION & BENEFITS\n\n- **Salary Analysis & Market Comparison**: The provided data does not include salary information. A thorough salary analysis would require comparing typical salaries for Integration & Test Engineers with 5 years of experience and a TS/SCI clearance in the Aurora, CO area. Websites like Glassdoor, LinkedIn Salary, and specialized defense industry job boards (like the source of this posting, [clearancejobs.com](https://www.clearancejobs.com/jobs/8212863/integration-test-engineer-914713812)) would be necessary to gather this data. The TS/SCI clearance is a significant factor that typically commands a higher salary compared to roles without this requirement.\n\n- **Benefits Package Assessment**: The provided data does not detail the benefits package. A comprehensive assessment would need to evaluate health insurance (medical, dental, vision), retirement plans (401k matching), paid time off (vacation, sick leave, holidays), and potentially other benefits like life insurance, disability insurance, and professional development opportunities. Paid time off is a valued benefit to consider [wm.edu](https://www.wm.edu/offices/career/students/resource-library/handouts/evaluating-your-job-offer-2024-final.pdf).\n\n- **Total Compensation Value Proposition**: The total compensation value proposition includes not just the base salary but also the value of the benefits package. For this role, the value of the TS/SCI clearance, the opportunity to work on critical defense projects, and exposure to modern technologies (DevSecOps, CI/CD) should also be factored in as part of the overall value, even if not directly financial.\n\n## \ud83d\udccd LOCATION & WORKPLACE ANALYSIS\n\n- **Geographic Considerations**: The position is located in Aurora, CO. Aurora is part of the Denver metropolitan area, which is a hub for the aerospace and defense industries. This location offers access to a concentration of companies and professionals in this sector. It also provides access to outdoor recreational activities and a relatively strong job market.\n\n- **Workplace Model (Remote/Hybrid/Onsite)**: This is an on-site/office role. This means the employee is expected to work from the company's physical location in Aurora, CO. This model offers direct interaction with colleagues and potentially easier access to necessary hardware and secure systems, which is often critical for roles requiring high-level security clearances. However, it lacks the flexibility of remote or hybrid work models.\n\n- **Local Market Dynamics**: The Denver-Aurora area has a significant presence of defense contractors and technology companies. This creates a local market with demand for skilled professionals with security clearances. The presence of related job postings in the area confirms this [itjobpro.com](https://itjobpro.com/job/system-integration-and-test-engineer-3) [itjobpro.com](https://itjobpro.com/job/senior-software-engineer-site-reliability-ci-cd).\n\n- **Cost of Living Considerations**: The cost of living in the Denver metropolitan area is generally higher than the national average, particularly regarding housing. This should be factored into the assessment of the compensation package's value. A salary that might be competitive in a lower cost-of-living area may have less purchasing power in Aurora, CO.\n\n## \u2696\ufe0f OPPORTUNITY ASSESSMENT\n\n- **Key Advantages**:\n    * **Opportunity to work on critical defense projects**: This provides a sense of purpose and contributes to national security.\n    * **Exposure to modern DevSecOps and CI/CD techniques**: These are highly valuable and in-demand skills.\n    * **Utilization of a high-level security clearance (TS/SCI)**: This clearance is a significant asset and opens doors to specialized roles.\n    * **Working in a small team environment**: Potentially offers more direct impact and broader responsibilities.\n    * **Location in a defense industry hub (Aurora, CO)**: Provides access to a relevant professional network.\n\n- **Potential Challenges**:\n    * **On-site work model**: Lacks the flexibility of remote or hybrid options.\n    * **Requirement for active TS/SCI clearance**: Limits the pool of eligible candidates and requires maintaining the clearance.\n    * **Potential for strict protocols and procedures**: Common in defense-related work due to security requirements.\n    * **Limited information on company culture and benefits**: Requires further investigation during the application process.\n\n- **Growth Potential**: The role offers solid growth potential in specialized areas like test automation, DevSecOps, and potentially leadership within the defense tech sector. Gaining experience with critical systems and modern practices is a strong foundation for future career advancement.\n\n- **Strategic Considerations**: For a candidate with a TS/SCI clearance, this role represents a strategic opportunity to leverage that asset in a relevant and potentially impactful position. The focus on modern technologies like DevSecOps and CI/CD aligns with current industry trends, making the skills gained transferable and valuable for future career moves within or outside the defense sector.\n\n## \ud83c\udfaf RECOMMENDATIONS & ACTION ITEMS\n\n- **Key Decision Factors**:\n    * **Alignment with career goals in defense/government contracting**: Is this sector and type of work a long-term interest?\n    * **Value of the TS/SCI clearance**: Is leveraging this clearance a priority?\n    * **Comfort with an on-site work model**: Does the lack of remote/hybrid options align with personal preferences?\n    * **Interest in signal processing and real-time operational environments**: Is the core technical domain engaging?\n    * **Compensation and benefits package**: Once known, does it meet financial and personal needs, considering the cost of living in Aurora, CO?\n\n- **Preparation Steps**:\n    * **Update resume**: Highlight relevant experience in C++, Python, software integration, and test automation. Emphasize experience working on projects requiring security clearances if applicable.\n    * **Prepare for technical interviews**: Brush up on C++ and Python coding skills, as well as concepts related to software integration, testing, and test automation.\n    * **Research Smart Synergies**: Try to find more information about the company's specific projects, culture, and values.\n    * **Prepare questions for the interviewer**: Ask about the team size, specific projects, the technology stack, opportunities for professional development, and details about the benefits package.\n\n- **Application Strategy**:\n    * **Tailor the application**: Customize the resume and cover letter to specifically address the requirements and preferred qualifications listed in the job posting.\n    * **Highlight the TS/SCI clearance**: Make the clearance status clearly visible on the resume and mention its relevance in the cover letter.\n    * **Showcase experience with required and preferred skills**: Provide concrete examples of how you have used C++, Python, and implemented test automation.\n\n- **Negotiation Considerations**:\n    * **Research salary benchmarks**: Gather data on typical salaries for similar roles with TS/SCI clearance in the Aurora, CO area.\n    * **Consider the total compensation**: Evaluate the value of the benefits package in addition to the base salary.\n    * **Be prepared to articulate your value**: Highlight your relevant experience, skills, and the value of your security clearance during salary negotiations.\n    * **Negotiate based on market data and your qualifications**: Use your research to support your salary request."
}